posting_id,source,title,company,role,ai_inflected,seniority_years,posted_date,skill_ids,skill_names,facets_present,salary_known,salary_period,monthly_min,monthly_max,monthly_point
104:90jry,104,LLM 模型開發工程師 | LLM Engineer,歐耀科技有限公司,ai_engineer,True,,,"python,r_lang,machine_learning,deep_learning,pytorch,tensorflow,ai_agents,fine_tuning,huggingface,llm,prompt_engineering,rag,model_serving,excel","Python, R, Machine Learning (general), Deep Learning (general), PyTorch, TensorFlow, AI Agents, Fine-tuning, Hugging Face, Large Language Models, Prompt Engineering, RAG, Model Serving, Excel","1,1,3,4,4,4,5,5,5,5,5,5,6,8",False,unknown,,,
104:8xnob,104,初級大型語言模型 (LLM) / 機器學習 (ML) 工程師,毅聲科技有限公司,data_scientist,True,2.0,,"python,r_lang,numpy,pandas,feature_engineering,machine_learning,scikit_learn,deep_learning,pytorch,tensorflow,ai_agents,fine_tuning,llm,docker,aws,azure,gcp","Python, R, NumPy, pandas, Feature Engineering, Machine Learning (general), scikit-learn, Deep Learning (general), PyTorch, TensorFlow, AI Agents, Fine-tuning, Large Language Models, Docker, AWS, Azure, GCP","1,1,2,2,3,3,3,4,4,4,5,5,5,6,7,7,7",False,unknown,,,
104:8t9ak,104,LLM 應用工程師 / LLM Application Engineer,禾多移動多媒體股份有限公司,data_scientist,True,,,"python,machine_learning,llm","Python, Machine Learning (general), Large Language Models","1,3,5",False,unknown,,,
104:55zfe,104,【不動產經紀人員】(新北市全區)挑戰月領7萬/房仲業務/新鮮人大學畢無工作經驗首選,信義房屋股份有限公司,data_scientist,False,,,machine_learning,Machine Learning (general),3,True,monthly,50000.0,70000.0,60000.0
104:7fgrb,104,PHP Web 工程師 (Junior or Mid level),夏木樂股份有限公司,backend,True,1.0,,"mysql,llm,nodejs,php","MySQL, Large Language Models, Node.js, PHP","2,5,9,9",True,monthly,45000.0,60000.0,52500.0
104:8t0l5,104,後端工程師 Backend Engineer,沃提利數位有限公司,backend,True,3.0,,"sql,mysql,redis,llm,ci_cd,kubernetes,gcp,php,rest_api","SQL, MySQL, Redis, Large Language Models, CI/CD, Kubernetes, GCP, PHP, REST API","1,2,2,5,6,6,7,9,9",True,monthly,50000.0,66000.0,58000.0
104:8wj0l,104,Golang 後端工程師 / Golang Backend Engineer,本公司其他工作,backend,False,3.0,,"golang,java,postgresql,redis,php","Go, Java, PostgreSQL, Redis, PHP","1,1,2,2,9",True,monthly,60000.0,,60000.0
104:7e88o,104,【ThreatVision】後端工程師 Backend Engineer,杜浦數位安全股份有限公司,backend,False,3.0,,"golang,java,python,kafka,elasticsearch,etl,mysql,redis,docker,kubernetes,aws,php","Go, Java, Python, Apache Kafka, Elasticsearch, ETL/ELT, MySQL, Redis, Docker, Kubernetes, AWS, PHP","1,1,1,2,2,2,2,2,6,6,7,9",False,unknown,,,
104:8w0h3,104,後端工程師,燦宇視界娛樂股份有限公司,backend,False,,,"golang,mysql,redis,ci_cd,kubernetes,gcp,nodejs,php","Go, MySQL, Redis, CI/CD, Kubernetes, GCP, Node.js, PHP","1,2,2,6,6,7,9,9",False,unknown,,,
104:7bngy,104,後端工程師,先鋒機械股份有限公司,backend,True,1.0,,"golang,mongodb,nosql,redis,statistics,llm,ci_cd,docker,kubernetes,dashboard,dotnet,nodejs,php,rest_api","Go, MongoDB, NoSQL, Redis, Statistics, Large Language Models, CI/CD, Docker, Kubernetes, Dashboarding, .NET, Node.js, PHP, REST API","1,2,2,2,3,5,6,6,6,8,9,9,9,9",True,monthly,50000.0,85000.0,67500.0
104:8smu5,104,後端工程師 Backend Engineer,飛起來行銷股份有限公司,backend,False,,,"golang,sql,nosql,postgresql,redis,docker,kubernetes,gcp,php,rest_api","Go, SQL, NoSQL, PostgreSQL, Redis, Docker, Kubernetes, GCP, PHP, REST API","1,1,2,2,2,6,6,7,9,9",True,monthly,40000.0,,40000.0
104:8mtao,104,後端工程師,沐訊科技股份有限公司,backend,False,3.0,,"golang,java,python,sql,dotnet,php","Go, Java, Python, SQL, .NET, PHP","1,1,1,1,9,9",True,monthly,40000.0,60000.0,50000.0
104:8i2ti,104,工作,,other,False,,,,,,False,unknown,,,
104:8xvjd,104,工作,,other,False,,,,,,False,unknown,,,
104:8d5gs,104,【SaaS】後端工程師 / Backend Engineer,鼎恒數位科技股份有限公司,backend,False,,,"golang,sql,kubernetes,dotnet,php","Go, SQL, Kubernetes, .NET, PHP","1,1,6,9,9",False,unknown,,,
104:8i2tj,104,後端工程師 Backend Engineer,禾凱企業有限公司,backend,False,,,"golang,sql,mysql,nosql,postgresql,redis,docker,aws,nodejs,php,rest_api","Go, SQL, MySQL, NoSQL, PostgreSQL, Redis, Docker, AWS, Node.js, PHP, REST API","1,1,2,2,2,2,6,7,9,9,9",False,unknown,,,
104:8o5p0,104,後端工程師,泰科動力股份有限公司,backend,False,,,"golang,python,nosql,ci_cd,docker,microservices,php","Go, Python, NoSQL, CI/CD, Docker, Microservices, PHP","1,1,2,6,6,9,9",False,unknown,,,
104:8rxe8,104,後端工程師,何聯資產管理有限公司,backend,False,3.0,,"golang,kafka,redis,docker,kubernetes,microservices,php,rest_api","Go, Apache Kafka, Redis, Docker, Kubernetes, Microservices, PHP, REST API","1,2,2,6,6,9,9,9",True,monthly,50000.0,,50000.0
104:8xi2q,104,後端工程師 Backend Engineer_高雄,昕力資訊股份有限公司,backend,False,2.0,,"golang,java,python,mysql,docker,aws,gcp,dotnet,django,nodejs,rest_api,spring","Go, Java, Python, MySQL, Docker, AWS, GCP, .NET, Django, Node.js, REST API, Spring Boot","1,1,1,2,6,7,7,9,9,9,9,9",False,unknown,,,
104:8rydt,104,後端工程師 / 資深後端工程師,千研萬宇科技有限公司,backend,False,,,"java,python,mysql,ci_cd,microservices,spring","Java, Python, MySQL, CI/CD, Microservices, Spring Boot","1,1,2,6,9,9",True,monthly,50000.0,100000.0,75000.0
104:8m48o,104,資深後端工程師,慧誠智醫股份有限公司,backend,False,6.0,,"java,python,docker,dotnet,flask,rest_api,spring","Java, Python, Docker, .NET, Flask, REST API, Spring Boot","1,1,6,9,9,9,9",False,unknown,,,
104:88goz,104,Golang後端工程師,威智國際有限公司,backend,False,,,"golang,mongodb,nosql,postgresql,redis,ci_cd,docker,kubernetes,aws,microservices,rest_api","Go, MongoDB, NoSQL, PostgreSQL, Redis, CI/CD, Docker, Kubernetes, AWS, Microservices, REST API","1,2,2,2,2,6,6,6,7,9,9",False,unknown,,,
104:87iru,104,後端工程師,水星工程科技有限公司,backend,False,,,"golang,sql,postgresql,docker,dotnet","Go, SQL, PostgreSQL, Docker, .NET","1,1,2,6,9",True,monthly,55000.0,65000.0,60000.0
104:91c7x,104,後端工程師,耕雲科技股份有限公司,backend,True,,,"golang,python,nosql,postgresql,redis,model_apis,rag,docker,rest_api","Go, Python, NoSQL, PostgreSQL, Redis, Foundation Model APIs, RAG, Docker, REST API","1,1,2,2,2,5,5,6,9",True,monthly,35000.0,50000.0,42500.0
104:8x8op,104,後端工程師,本公司其他工作,backend,False,1.0,,"golang,java,python,postgresql,redis,fastapi,aws,gcp","Go, Java, Python, PostgreSQL, Redis, FastAPI, AWS, GCP","1,1,1,2,2,6,7,7",False,unknown,,,
104:928rz,104,[R61] E-Commerce Backend Engineer,Yahoo_香港商雅虎資訊股份有限公司,backend,False,,,"golang,java,python,kafka,mysql,redis,ci_cd,docker,kubernetes,aws,gcp,microservices,php,rest_api,spring","Go, Java, Python, Apache Kafka, MySQL, Redis, CI/CD, Docker, Kubernetes, AWS, GCP, Microservices, PHP, REST API, Spring Boot","1,1,1,2,2,2,6,6,6,7,7,9,9,9,9",False,unknown,,,
104:7t8qn,104,.Net Core 後端工程師 Backend Engineer (C# / .NET Core),天茶智能科技股份有限公司,backend,False,3.0,,"golang,python,sql,redis,docker,azure,dashboard,dotnet,rest_api","Go, Python, SQL, Redis, Docker, Azure, Dashboarding, .NET, REST API","1,1,1,2,6,7,8,9,9",False,unknown,,,
104:8l8ox,104,後端工程師 Backend Engineer – Cloud Platform,熙飛科技股份有限公司,backend,False,4.0,,"golang,java,python,data_warehouse,postgresql,redis,ci_cd,docker,aws,dotnet,microservices","Go, Java, Python, Data Warehouse, PostgreSQL, Redis, CI/CD, Docker, AWS, .NET, Microservices","1,1,1,2,2,2,6,6,7,9,9",False,unknown,,,
104:5572i,104,好好證券-後端工程師 Backend Engineer (熟 Python、RESTful API ),好好證券股份有限公司,backend,False,2.0,,"java,python,mysql,redis,ci_cd,dotnet,flask,rest_api","Java, Python, MySQL, Redis, CI/CD, .NET, Flask, REST API","1,1,2,2,6,9,9,9",False,unknown,,,
104:8gcgt,104,Backend Engineer後端工程師,香港商蒙卓有限公司台灣分公司,backend,False,3.0,,"golang,java,python,mongodb,redis,docker,aws,gcp,dotnet,nodejs,rest_api","Go, Java, Python, MongoDB, Redis, Docker, AWS, GCP, .NET, Node.js, REST API","1,1,1,2,2,6,7,7,9,9,9",True,yearly,66666.66666666667,166666.66666666666,116666.66666666666
104:8rgy1,104,後端工程師 Backend Engineer,艾栩策略管理顧問有限公司,backend,False,1.0,,"python,sql,mysql,postgresql,redis,ci_cd,docker,dotnet,nodejs,php,rest_api","Python, SQL, MySQL, PostgreSQL, Redis, CI/CD, Docker, .NET, Node.js, PHP, REST API","1,1,2,2,2,6,6,9,9,9,9",False,unknown,,,
104:8xh4r,104,後端工程師 Backend Engineer_新竹,昕力資訊股份有限公司,backend,False,2.0,,"java,python,sql,mongodb,mysql,nosql,postgresql,redis,ci_cd,docker,fastapi,kubernetes,aws,azure,gcp,dotnet,django,nodejs,rest_api,spring","Java, Python, SQL, MongoDB, MySQL, NoSQL, PostgreSQL, Redis, CI/CD, Docker, FastAPI, Kubernetes, AWS, Azure, GCP, .NET, Django, Node.js, REST API, Spring Boot","1,1,1,2,2,2,2,2,6,6,6,6,7,7,7,9,9,9,9,9",False,unknown,,,
104:8t0j9,104,【思邁智能】後端工程師 - (Django) Backend Engineer,思邁智能股份有限公司,backend,False,3.0,,"java,python,docker,aws,django,rest_api","Java, Python, Docker, AWS, Django, REST API","1,1,6,7,9,9",True,yearly,50000.0,125000.0,87500.0
104:59at4,104,Backend Engineer 網頁後端工程師 ( Laravel / PHP / SMTP ),飛信資訊股份有限公司,backend,True,,,"python,mysql,ai_agents,ci_cd,django,php,rest_api","Python, MySQL, AI Agents, CI/CD, Django, PHP, REST API","1,2,5,6,9,9,9",True,yearly,66666.66666666667,91666.66666666667,79166.66666666667
104:926eo,104,AI產品開發後端工程師 Backend Engineer（含 K8S 維運經驗）,中華創智國際股份有限公司,backend,False,,,"java,python,mysql,postgresql,redis,ci_cd,docker,kubernetes,django,microservices,nodejs,php","Java, Python, MySQL, PostgreSQL, Redis, CI/CD, Docker, Kubernetes, Django, Microservices, Node.js, PHP","1,1,2,2,2,6,6,6,9,9,9,9",False,unknown,,,
104:8wfkm,104,【2026研發替代役】科技部_後端工程師 Backend Engineer,美好證券股份有限公司,backend,False,,,"java,python,mongodb,mysql,postgresql,ci_cd,kubernetes,django,nodejs,php","Java, Python, MongoDB, MySQL, PostgreSQL, CI/CD, Kubernetes, Django, Node.js, PHP","1,1,2,2,2,6,6,9,9,9",False,unknown,,,
104:8zkms,104,【SaaS】後端工程師 / Backend Engineer,鼎恒數位科技股份有限公司,backend,True,2.0,,"java,python,sql,ai_agents,llm,rag,vector_db,kubernetes,azure,dotnet,django,php,rest_api","Java, Python, SQL, AI Agents, Large Language Models, RAG, Vector Database, Kubernetes, Azure, .NET, Django, PHP, REST API","1,1,1,5,5,5,5,6,7,9,9,9,9",False,unknown,,,
104:82e8o,104,資深後端工程師 / Senior Backend Engineer (API-First / 跨語言協作),創造智能科技股份有限公司,backend,False,3.0,,"java,python,mysql,postgresql,ci_cd,docker,kubernetes,aws,gcp,django,microservices,php,rest_api","Java, Python, MySQL, PostgreSQL, CI/CD, Docker, Kubernetes, AWS, GCP, Django, Microservices, PHP, REST API","1,1,2,2,6,6,6,7,7,9,9,9,9",False,unknown,,,
104:7hvfj,104,Strategic Sourcing Manager,美商超微半導體股份有限公司台灣分公司,other,False,5.0,,,,,False,unknown,,,
104:8qd3r,104,Senior Backend Engineer – Platform & Data Systems,邁智微電子股份有限公司,data_engineer,False,,,"golang,java,python,kafka,spark,hadoop,mongodb,mysql,ci_cd,docker,kubernetes,aws,spring","Go, Java, Python, Apache Kafka, Apache Spark, Hadoop, MongoDB, MySQL, CI/CD, Docker, Kubernetes, AWS, Spring Boot","1,1,1,2,2,2,2,2,6,6,6,7,9",True,yearly,83333.33333333333,,83333.33333333333
104:92c46,104,Power Platform/BI (系統開發)工程師(竹北-總管理處),鋒霈環境科技股份有限公司,data_analyst,False,2.0,,"sql,mysql,postgresql,azure,dashboard,excel,power_bi","SQL, MySQL, PostgreSQL, Azure, Dashboarding, Excel, Power BI","1,2,2,7,8,8,8",False,unknown,,,
104:90il1,104,Data Science Specialist,Human8_香港商因賽思股份有限公司台灣分公司,data_analyst,False,2.0,,"python,r_lang,statistics,time_series,excel,tableau","Python, R, Statistics, Time Series, Excel, Tableau","1,1,3,3,8,8",False,unknown,,,
104:8djx6,104,【美商特殊玻璃大廠】SAP Project Manager / SAP Platform Delivery and Optimization Data Lead -701KL,萬寶華企業管理顧問股份有限公司,other,False,5.0,,,,,True,yearly,125000.0,400000.0,262500.0
104:8z5mq,104,Giant Group Digital Experience Platform Specialist,捷安特_巨大機械工業股份有限公司,other,False,3.0,,,,,False,unknown,,,
104:71tgy,104,Clinical Data Manager,美商布萊特有限公司台灣分公司,data_analyst,False,,,excel,Excel,8,False,unknown,,,
104:8py52,104,【北士科】Data Platform PM / AI Platform PM,沛思坦網路股份有限公司,ml_engineer,True,5.0,,"etl,computer_vision,nlp,mlflow,model_serving,aws","ETL/ELT, Computer Vision, NLP, MLflow, Model Serving, AWS","2,4,4,6,6,7",False,unknown,,,
104:8yd23,104,Clinical Data Manager,美商賽美斯醫學科技有限公司,data_scientist,False,1.0,,"statistics,gcp","Statistics, GCP","3,7",False,unknown,,,
104:92icp,104,韌體工程師 Platform Firmware Engineer（ARM / x86),新加坡商艾得克有限公司台灣分公司,other,False,2.0,,,,,True,yearly,50000.0,166666.66666666666,108333.33333333333
104:90oed,104,Data Center Technician,新加坡商優思特股份有限公司台灣分公司,other,False,2.0,,,,,False,unknown,,,
104:8zc3r,104,TW OCS-PDC-Asi-DBA/Data Platform Engineer,光寶科技股份有限公司,data_engineer,False,3.0,,"sql,mysql","SQL, MySQL","1,2",False,unknown,,,
104:90phw,104,"全端資料工程師（資料平台） Full Stack Engineer (Data Platform)(台南優先,台中)",葳誠科技有限公司,data_engineer,True,,,"java,python,sql,data_warehouse,machine_learning,ai_agents,llm,ci_cd,aws,azure,databricks,php,rest_api","Java, Python, SQL, Data Warehouse, Machine Learning (general), AI Agents, Large Language Models, CI/CD, AWS, Azure, Databricks, PHP, REST API","1,1,1,2,3,5,5,6,7,7,7,9,9",True,monthly,70000.0,100000.0,85000.0
104:91kxm,104,[Music] Senior Data Engineer,新加坡商科科科技股份有限公司台灣分公司,data_engineer,False,4.0,,"python,scala,airflow,spark,etl,ab_testing,machine_learning,docker,kubernetes,aws,gcp","Python, Scala, Airflow, Apache Spark, ETL/ELT, A/B Testing, Machine Learning (general), Docker, Kubernetes, AWS, GCP","1,1,2,2,2,3,3,6,6,7,7",False,unknown,,,
104:915to,104,資料架構師 Data Architecture,宏碁資訊服務股份有限公司,data_engineer,True,7.0,,"python,sql,spark,etl,postgresql,llm,rag,vector_db,azure,databricks","Python, SQL, Apache Spark, ETL/ELT, PostgreSQL, Large Language Models, RAG, Vector Database, Azure, Databricks","1,1,2,2,2,5,5,5,7,7",False,unknown,,,
104:8ihao,104,Platform Engineer｜Cloud Infrastructure & IoT Platform,凱智綠能科技股份有限公司,backend,True,,,"python,mysql,postgresql,redis,ai_agents,model_apis,llm,ci_cd,docker,kubernetes,aws,gcp,dashboard,nodejs,php,rest_api","Python, MySQL, PostgreSQL, Redis, AI Agents, Foundation Model APIs, Large Language Models, CI/CD, Docker, Kubernetes, AWS, GCP, Dashboarding, Node.js, PHP, REST API","1,2,2,2,5,5,5,6,6,6,7,7,8,9,9,9",False,unknown,,,
104:91j0c,104,DevOps / Platform Engineer,張量科技股份有限公司,data_engineer,False,3.0,,"bash,python,ci_cd,docker,kubernetes,aws,azure,gcp","Bash/Shell, Python, CI/CD, Docker, Kubernetes, AWS, Azure, GCP","1,1,6,6,6,7,7,7",False,unknown,,,
104:8x3gi,104,商業分析師,拓樸龍科技股份有限公司,data_analyst,False,3.0,,"dashboard,excel","Dashboarding, Excel","8,8",True,monthly,50000.0,,50000.0
104:90grm,104,Business Analyst (商業分析師),印度商印福思股份有限公司台灣分公司,data_analyst,False,3.0,,"excel,power_bi","Excel, Power BI","8,8",False,unknown,,,
104:8vvy4,104,Business Analyst (商業分析師),印度商印福思股份有限公司台灣分公司,data_analyst,False,3.0,,excel,Excel,8,False,unknown,,,
104:8y966,104,BA商業分析師,東洋洗濯事業股份有限公司,ai_engineer,True,5.0,,"llm,aws","Large Language Models, AWS","5,7",True,monthly,40000.0,,40000.0
104:8xkdo,104,PA-知名外商 徵 商業分析師 (英文中上/6個月短期專案/1-2年以上相關經驗),新加坡商立可人事顧問有限公司台灣分公司,data_analyst,False,2.0,,excel,Excel,8,False,unknown,,,
104:8xwr4,104,【台北】BA商業分析師 【OS】,普鴻資訊股份有限公司,data_analyst,False,3.0,,excel,Excel,8,False,unknown,,,
104:909fv,104,商業分析師BA_(台南外商),億力資訊股份有限公司,ai_engineer,True,3.0,,llm,Large Language Models,5,False,unknown,,,
104:8fh8r,104,資訊_商業分析師(BA),中信金控_台灣人壽保險股份有限公司,other,False,5.0,,,,,False,unknown,,,
104:8xx4z,104,商業分析師(壽險),新加坡商易呈有限公司臺灣分公司,other,False,4.0,,,,,False,unknown,,,
104:91q6h,104,【外商保險系統】助理商業分析師 (Junior BA) ｜ 歡迎保險業1年+(不限科系)、風管/保險/資管應屆,澄楓資訊股份有限公司,data_analyst,False,,,"dashboard,excel","Dashboarding, Excel","8,8",True,monthly,36000.0,47999.0,41999.5
104:90qxd,104,資深數據分析師/資深商業分析師,東森購物_電視購物_東森得易購股份有限公司,data_scientist,True,3.0,,"python,sql,feature_engineering,machine_learning,statistics,llm,prompt_engineering,aws,azure,gcp","Python, SQL, Feature Engineering, Machine Learning (general), Statistics, Large Language Models, Prompt Engineering, AWS, Azure, GCP","1,1,3,3,3,5,5,7,7,7",False,unknown,,,
104:8lbae,104,【經營管理】商業分析師 Business Analyst（專案組）,PChome Online_網路家庭國際資訊(股)公司,data_analyst,False,3.0,,"python,sql,machine_learning,time_series,dashboard,excel,looker,tableau","Python, SQL, Machine Learning (general), Time Series, Dashboarding, Excel, Looker, Tableau","1,1,3,3,8,8,8,8",False,unknown,,,
104:90osi,104,資訊服務部 商業分析師 Insurance Business Process Analyst,法商法國巴黎人壽保險股份有限公司台灣分公司,data_analyst,False,5.0,,excel,Excel,8,False,unknown,,,
104:8xw8k,104,Business Analyst 商業分析師 (金融系統),Tata Consultancy Services Limited Taiwan Branch_印度商塔塔顧問服務有限公司台灣分公司,data_analyst,False,3.0,,"excel,spring","Excel, Spring Boot","8,9",False,unknown,,,
104:8zk7q,104,【個人金融】商業分析師Business Analyst,玉山銀行_玉山商業銀行股份有限公司,other,False,,,,,,False,unknown,,,
104:86ron,104,核心_商業分析師 BA,遠雄人壽保險事業股份有限公司(總公司),data_analyst,False,10.0,,excel,Excel,8,False,unknown,,,
104:92gye,104,初階商業分析師 (JBA),雙子數位科技有限公司,data_analyst,False,1.0,,"dashboard,excel","Dashboarding, Excel","8,8",False,unknown,,,
104:91tbv,104,C6251 商業分析師 Senior Analyst(EA),遠傳電信股份有限公司,data_analyst,False,3.0,,"python,r_lang,sql,dashboard,data_viz","Python, R, SQL, Dashboarding, Data Visualization","1,1,1,8,8",False,unknown,,,
104:8kqr1,104,商業分析師 (BA),雙子數位科技有限公司,data_analyst,False,3.0,,excel,Excel,8,False,unknown,,,
104:91bly,104,【Uber Eats】Channel Sales Executive 餐廳通路經銷業務(台南),新加坡商立福人事顧問有限公司台灣分公司,data_analyst,False,1.0,,dashboard,Dashboarding,8,True,monthly,46000.0,50000.0,48000.0
104:8jtzf,104,【UberEats 餐廳開發業務(台中)】月薪40K~55K起、前三個月享額外津貼8K起｜工時彈性自由｜滿3個月即享10天年假,新加坡商立福人事顧問有限公司台灣分公司,other,False,,,,,,True,monthly,40000.0,55000.0,47500.0
104:8bwrd,104,Business Analyst,伊雲谷數位科技股份有限公司,data_analyst,False,1.0,,"aws,dashboard,excel,power_bi","AWS, Dashboarding, Excel, Power BI","7,8,8,8",False,unknown,,,
104:8kbwm,104,Business Analyst,伊雲谷數位科技股份有限公司,data_analyst,False,1.0,,"aws,excel,power_bi,tableau","AWS, Excel, Power BI, Tableau","7,8,8,8",False,unknown,,,
104:8yx4b,104,【CB05002】Business Analyst,雲馥數位股份有限公司,data_analyst,False,1.0,,"excel,power_bi,tableau","Excel, Power BI, Tableau","8,8,8",False,unknown,,,
104:90hr3,104,SA22057 Business Analyst,華碩電腦股份有限公司,other,False,3.0,,,,,False,unknown,,,
104:8tyd5,104,Business Analyst,台昇國際股份有限公司,data_analyst,False,,,data_viz,Data Visualization,8,False,unknown,,,
104:7v0oc,104,Business Analyst (系統分析師),欒軒管理顧問有限公司,data_analyst,False,2.0,,statistics,Statistics,3,True,monthly,45000.0,,45000.0
104:8vwl5,104,MIS-Business Analyst Engineer (Hsinchu),遠東金士頓科技股份有限公司,other,False,3.0,,computer_vision,Computer Vision,4,False,unknown,,,
104:8t930,104,TP- Financial Analyst / Business Analyst,金盛世紙業有限公司,data_analyst,False,5.0,,excel,Excel,8,False,unknown,,,
104:8zrsv,104,Business Analyst,本公司其他工作,data_analyst,False,3.0,,"python,r_lang,sql,mysql,statistics,computer_vision,looker,power_bi,tableau","Python, R, SQL, MySQL, Statistics, Computer Vision, Looker, Power BI, Tableau","1,1,1,2,3,4,8,8,8",False,unknown,,,
104:91khm,104,(HQ) Business Analyst,鴻霖航空貨運代理股份有限公司,data_analyst,False,2.0,,excel,Excel,8,False,unknown,,,
104:8vsgz,104,業務分析師 Business Analyst,鑫鼎鑽科技有限公司,data_analyst,False,1.0,,"sql,etl,statistics,dashboard,excel,looker,power_bi,tableau","SQL, ETL/ELT, Statistics, Dashboarding, Excel, Looker, Power BI, Tableau","1,2,3,8,8,8,8,8",True,monthly,45000.0,,45000.0
104:8um5t,104,資深營運分析師 Senior Business Analyst,中磊電子股份有限公司,data_analyst,False,2.0,,"dashboard,power_bi,tableau","Dashboarding, Power BI, Tableau","8,8,8",False,unknown,,,
104:7xlys,104,系統分析師 | Business Analyst/ Subject Matter Expert (SME),星展(台灣)商業銀行股份有限公司,data_analyst,False,2.0,,"sql,mysql,ci_cd,tableau","SQL, MySQL, CI/CD, Tableau","1,2,6,8",False,unknown,,,
104:8fxph,104,H.經營分析管理師(Business Analyst),永豐餘消費品實業股份有限公司,data_analyst,False,7.0,,dashboard,Dashboarding,8,False,unknown,,,
104:8hpc4,104,資訊處-業務分析師(精通越文)Business Analyst (Fluent in Vietnamese),永豐商業銀行股份有限公司,data_scientist,False,,,python,Python,1,False,unknown,,,
104:908ol,104,"210728418 Asset Management - Taiwan Institutional Business, Sales Support - Associate / Analyst",摩根證券投資信託股份有限公司,other,False,4.0,,,,,False,unknown,,,
104:5qu7r,104,A2-商業分析師 (Data & Business Analyst),意藍資訊股份有限公司,other,False,,,,,,True,monthly,35000.0,40000.0,37500.0
104:90ht6,104,AI應用工程師(AI Application Engineer),艾美斯科技有限公司,ai_engineer,True,2.0,,"java,python,machine_learning,deep_learning,model_apis,langchain,llm,prompt_engineering,rag","Java, Python, Machine Learning (general), Deep Learning (general), Foundation Model APIs, LangChain, Large Language Models, Prompt Engineering, RAG","1,1,3,4,5,5,5,5,5",False,unknown,,,
104:68t3v,104,AI深度學習工程師,聰泰科技開發股份有限公司,ml_engineer,False,,,"machine_learning,deep_learning","Machine Learning (general), Deep Learning (general)","3,4",False,unknown,,,
104:91uw8,104,多模態 AI 視覺深度學習工程師,富萱科技股份有限公司,ml_engineer,True,2.0,,"python,machine_learning,statistics,computer_vision,deep_learning,pytorch,tensorflow,transformer,fine_tuning,llm,lora,docker","Python, Machine Learning (general), Statistics, Computer Vision, Deep Learning (general), PyTorch, TensorFlow, Transformer, Fine-tuning, Large Language Models, LoRA / PEFT, Docker","1,3,3,4,4,4,4,4,5,5,5,6",False,unknown,,,
104:7mvok,104,AI 工程師、深度學習工程師、人工智慧研究員（AI Engineer）,玩構網路科技有限公司,ml_engineer,True,3.0,,"python,machine_learning,deep_learning,pytorch,tensorflow,transformer,diffusion,fine_tuning,llm","Python, Machine Learning (general), Deep Learning (general), PyTorch, TensorFlow, Transformer, Diffusion Models, Fine-tuning, Large Language Models","1,3,4,4,4,4,5,5,5",True,monthly,60000.0,80000.0,70000.0
104:8iy9i,104,資料科學/深度學習工程師,富智康國際股份有限公司,ml_engineer,False,,,"python,machine_learning,computer_vision,deep_learning","Python, Machine Learning (general), Computer Vision, Deep Learning (general)","1,3,4,4",False,unknown,,,
104:6kutq,104,AOI/AI影像深度學習工程師,悟智股份有限公司,ml_engineer,True,,,"python,deep_learning,pytorch,tensorflow,llm,data_viz","Python, Deep Learning (general), PyTorch, TensorFlow, Large Language Models, Data Visualization","1,4,4,4,5,8",False,unknown,,,
104:86auy,104,資料科學/深度學習工程師 Data Scientist / Deep Learning Engineer,優式機器人股份有限公司,ml_engineer,False,,,"python,machine_learning,computer_vision,deep_learning","Python, Machine Learning (general), Computer Vision, Deep Learning (general)","1,3,4,4",False,unknown,,,
104:8wadw,104,AI深度學習演算法工程師,得勝醫學科技股份有限公司,ml_engineer,True,5.0,,"python,machine_learning,deep_learning,pytorch,tensorflow,llm","Python, Machine Learning (general), Deep Learning (general), PyTorch, TensorFlow, Large Language Models","1,3,4,4,4,5",False,unknown,,,
104:8voqa,104,機器人-AOI視覺 演算法工程師,伊士博國際商業股份有限公司,ml_engineer,False,2.0,,"python,feature_engineering,machine_learning,deep_learning,pytorch,tensorflow","Python, Feature Engineering, Machine Learning (general), Deep Learning (general), PyTorch, TensorFlow","1,3,3,4,4,4",True,monthly,70000.0,98000.0,84000.0
